[
  {
    "id": "AN-001",
    "source": "zendesk",
    "source_ref": "ticket/48201",
    "date": "2026-06-03",
    "segment": "SMB",
    "persona": "Office manager",
    "pain": "Finding a meeting slot across three calendars takes too long",
    "quote": "Every time I need to book a client call I open three calendars and compare them by eye. It takes me twenty minutes for a thirty minute call. Then I still have to email the other side to confirm, wait…",
    "sentiment": -2,
    "linked_problem": "PB-1",
    "frequency_hint": null,
    "consent_ok": true
  },
  {
    "id": "AN-002",
    "source": "zendesk",
    "source_ref": "ticket/48202",
    "date": "2026-06-05",
    "segment": "Mid-market",
    "persona": "Sales operations lead",
    "pain": "Back-and-forth emails to agree a time",
    "quote": "We send five or six emails just to agree a time for one demo. Prospects give up before we ever confirm the slot.",
    "sentiment": -2,
    "linked_problem": "PB-1",
    "frequency_hint": null,
    "consent_ok": true
  },
  {
    "id": "AN-003",
    "source": "nps",
    "source_ref": "nps/9001",
    "date": "2026-06-09",
    "segment": "Enterprise",
    "persona": "IT administrator",
    "pain": "IT approval blocks the calendar integration",
    "quote": "Our security team has not approved the calendar integration yet, so nobody on my team can connect their calendar and everyone schedules by hand.",
    "sentiment": -1,
    "linked_problem": "PB-1",
    "frequency_hint": null,
    "consent_ok": true
  },
  {
    "id": "AN-004",
    "source": "gong",
    "source_ref": "call/7710",
    "date": "2026-06-11",
    "segment": "Enterprise",
    "persona": "VP of Operations",
    "pain": "Scheduling across time zones and teams is slow",
    "quote": "Honestly the slowest part of onboarding a new customer is getting six people from three time zones into one room. We lose a week on scheduling alone, and the kickoff meeting keeps slipping because someone's calendar is always full when…",
    "sentiment": -2,
    "linked_problem": "PB-1",
    "frequency_hint": null,
    "consent_ok": true
  },
  {
    "id": "AN-005",
    "source": "interview",
    "source_ref": "int/301",
    "date": "2026-06-14",
    "segment": "SMB",
    "persona": "Founder",
    "pain": "Wants one-click booking",
    "quote": "I would pay for anything that lets a customer pick a time without me replying to an email.",
    "sentiment": -1,
    "linked_problem": "PB-1",
    "frequency_hint": null,
    "consent_ok": true
  },
  {
    "id": "AN-006",
    "source": "zendesk",
    "source_ref": "ticket/48203",
    "date": "2026-06-16",
    "segment": "SMB",
    "persona": "Recruiter",
    "pain": "Candidate scheduling is manual",
    "quote": "Please email me at [email] when the interview scheduling fix ships. I currently schedule each candidate by hand.",
    "sentiment": -1,
    "linked_problem": "PB-1",
    "frequency_hint": null,
    "consent_ok": true
  },
  {
    "id": "AN-007",
    "source": "nps",
    "source_ref": "nps/9002",
    "date": "2026-06-22",
    "segment": "Mid-market",
    "persona": "Account executive",
    "pain": "Love the new booking page",
    "quote": "The new booking page is great. Prospects pick a time in seconds and my calendar stays clean. Scheduling used to be my worst chore.",
    "sentiment": 2,
    "linked_problem": "PB-1",
    "frequency_hint": null,
    "consent_ok": true
  },
  {
    "id": "AN-008",
    "source": "gong",
    "source_ref": "call/7711",
    "date": "2026-06-24",
    "segment": "Enterprise",
    "persona": "Director of IT",
    "pain": "Integration approval takes months",
    "quote": "Getting a calendar integration through our review board took four months. By then the team had gone back to email threads to schedule meetings.",
    "sentiment": -2,
    "linked_problem": "PB-1",
    "frequency_hint": null,
    "consent_ok": true
  },
  {
    "id": "AN-009",
    "source": "zendesk",
    "source_ref": "ticket/48206",
    "date": "2026-06-26",
    "segment": "SMB",
    "persona": "Practice manager",
    "pain": "Call me about scheduling double-bookings",
    "quote": "We keep getting double-booked. Call me on [phone] so I can explain which calendars clash.",
    "sentiment": -2,
    "linked_problem": "PB-1",
    "frequency_hint": null,
    "consent_ok": true
  },
  {
    "id": "AN-010",
    "source": "interview",
    "source_ref": "int/302",
    "date": "2026-07-01",
    "segment": "Enterprise",
    "persona": "Chief of Staff",
    "pain": "Executive scheduling is a full-time job",
    "quote": "[name] spends half of every day moving meetings around the executive team's calendars. A tool that proposes times automatically would give that time back.",
    "sentiment": -2,
    "linked_problem": "PB-1",
    "frequency_hint": null,
    "consent_ok": true
  },
  {
    "id": "AN-011",
    "source": "zendesk",
    "source_ref": "ticket/48207",
    "date": "2026-07-05",
    "segment": "Enterprise",
    "persona": "Procurement lead",
    "pain": "[company] needs IT approval paperwork",
    "quote": "[company] cannot turn on calendar sync until our IT approval is done. Please send the security questionnaire so scheduling can start.",
    "sentiment": -1,
    "linked_problem": "PB-1",
    "frequency_hint": null,
    "consent_ok": true
  },
  {
    "id": "AN-012",
    "source": "nps",
    "source_ref": "nps/9004",
    "date": "2026-07-08",
    "segment": "SMB",
    "persona": "Freelance consultant",
    "pain": "Scheduling works well for me",
    "quote": "Booking links work well. Clients book themselves into my free slots and I never touch email for scheduling any more.",
    "sentiment": 1,
    "linked_problem": "PB-1",
    "frequency_hint": null,
    "consent_ok": true
  },
  {
    "id": "AN-013",
    "source": "interview",
    "source_ref": "int/303",
    "date": "2026-07-15",
    "segment": "SMB",
    "persona": "Clinic coordinator",
    "pain": "Patients cannot self-schedule",
    "quote": "Patients phone us to book. Reach the front desk team at [phone] or have them email [email], and we write each time into the calendar by hand.",
    "sentiment": -1,
    "linked_problem": "PB-1",
    "frequency_hint": null,
    "consent_ok": true
  },
  {
    "id": "AN-014",
    "source": "gong",
    "source_ref": "call/7714",
    "date": "2026-07-23",
    "segment": "Mid-market",
    "persona": "Customer success director",
    "pain": "Scheduling is why we chose you",
    "quote": "Smart scheduling was the reason we picked you over the other vendors. Meetings with customers get booked in a couple of clicks and that has changed how we work.",
    "sentiment": 2,
    "linked_problem": "PB-1",
    "frequency_hint": null,
    "consent_ok": true
  },
  {
    "id": "AN-015",
    "source": "interview",
    "source_ref": "int/304",
    "date": "2026-07-28",
    "segment": "Mid-market",
    "persona": "Product designer",
    "pain": "Hard to find a time for research calls",
    "quote": "Scheduling research calls with participants takes more effort than the research itself, mostly because of calendar mismatches and slow email replies.",
    "sentiment": -1,
    "linked_problem": "PB-1",
    "frequency_hint": null,
    "consent_ok": true
  },
  {
    "id": "AN-016",
    "source": "nps",
    "source_ref": "nps/9006",
    "date": "2026-08-01",
    "segment": "SMB",
    "persona": "Salon owner",
    "pain": "Reminders reduce no-shows",
    "quote": "Appointment reminders cut my no-shows a lot. Scheduling is easier since I switched.",
    "sentiment": 1,
    "linked_problem": "PB-1",
    "frequency_hint": null,
    "consent_ok": true
  }
]
