{
  "id": "AN-001",
  "source": "zendesk",
  "source_ref": "ticket/48213",
  "date": "2026-09-12",
  "segment": "SMB",
  "persona": "Account admin",
  "pain": "Can't finish setup without IT help",
  "quote": "I had to call our IT team just to get past step 3. It should be simpler.",
  "sentiment": -2,
  "linked_problem": "PB-001",
  "frequency_hint": "EV-001",
  "consent_ok": true
}
